SQL> connect
Enter user-name: system
Enter password:
Connected.

DDL Commands:create,desc,rename,alter,truncate,drop.

SQL> create table books
  2  (
  3  book_id number(4),
  4  book_title varchar2(20),
  5  author varchar2(20),
  6  publisher varchar2(20),
  7  prize number(7)
  8  );

Table created.

SQL> desc books;
 Name                                      Null?    Type
 ----------------------------------------- -------- ----------------------------
 BOOK_ID                                            NUMBER(4)
 BOOK_TITLE                                         VARCHAR2(20)
 AUTHOR                                             VARCHAR2(20)
 PUBLISHER                                          VARCHAR2(20)
 PRIZE                                              NUMBER(7)

SQL> rename books to books_record;

Table renamed.

SQL> desc books_record;
 Name                                      Null?    Type
 ----------------------------------------- -------- ----------------------------
 BOOK_ID                                            NUMBER(4)
 BOOK_TITLE                                         VARCHAR2(20)
 AUTHOR                                             VARCHAR2(20)
 PUBLISHER                                          VARCHAR2(20)
 PRIZE                                              NUMBER(7)

SQL> alter table books_record
  2  add phone_no number(10);

Table altered.

SQL> desc books_record;
 Name                                      Null?    Type
 ----------------------------------------- -------- ----------------------------
 BOOK_ID                                            NUMBER(4)
 BOOK_TITLE                                         VARCHAR2(20)
 AUTHOR                                             VARCHAR2(20)
 PUBLISHER                                          VARCHAR2(20)
 PRIZE                                              NUMBER(7)
 PHONE_NO                                           NUMBER(10)

SQL> alter table books_record
  2  modify prize number(3);

Table altered.

SQL> desc books_record;
 Name                                      Null?    Type
 ----------------------------------------- -------- ----------------------------
 BOOK_ID                                            NUMBER(4)
 BOOK_TITLE                                         VARCHAR2(20)
 AUTHOR                                             VARCHAR2(20)
 PUBLISHER                                          VARCHAR2(20)
 PRIZE                                              NUMBER(3)
 PHONE_NO                                           NUMBER(10)

SQL> alter table books_record
  2  drop column book_title;

Table altered.

SQL> desc books_record;
 Name                                      Null?    Type
 ----------------------------------------- -------- ----------------------------
 BOOK_ID                                            NUMBER(4)
 AUTHOR                                             VARCHAR2(20)
 PUBLISHER                                          VARCHAR2(20)
 PRIZE                                              NUMBER(3)
 PHONE_NO                                           NUMBER(10)

SQL> create table student
  2  (
  3  );
)
*
ERROR at line 3:
ORA-00904: : invalid identifier// error occurred since there is no specified attribute i.e row


SQL> create table student
  2  (
  3  name varchar2(20),
  4  rollno number(4),
  5  marks number(2)
  6  );

Table created.

SQL> truncate table student;

Table truncated.
//truncate is applied only to the rows but not to the columns.

SQL> desc student;
 Name                                      Null?    Type
 ----------------------------------------- -------- ----------------------------
 NAME                                               VARCHAR2(20)
 ROLLNO                                             NUMBER(4)
 MARKS                                              NUMBER(2)


SQL> alter table student
  2  drop column marks;

Table altered.

SQL> desc student;
 Name                                      Null?    Type
 ----------------------------------------- -------- ----------------------------
 NAME                                               VARCHAR2(20)
 ROLLNO                                             NUMBER(4)

SQL> drop table student;

Table dropped.

SQL> desc student;
ERROR:
ORA-04043: object student does not exist

DML Commands:insert,select-(DQL),update,delete.


SQL> create table instructor
  2  (
  3  inst_id number(4),
  4  name varchar2(20),
  5  dob date,
  6  post varchar2(20),
  7  phno number(10)
  8  );

Table created.

SQL> insert into instructor values
  2  (101,'rama','01-feb-02','lecturer',7893860298);

1 row created.

SQL> select *from instructor;

   INST_ID NAME                 DOB       POST                       PHNO
---------- -------------------- --------- -------------------- ----------
       101 rama                 01-FEB-02 lecturer             7893860298

SQL> insert into instructor values
  2  (101,'rama','01-feb-02','lecturer',7893860298);

1 row created.

SQL> select *from instructor;

   INST_ID NAME                 DOB       POST                       PHNO
---------- -------------------- --------- -------------------- ----------
       101 rama                 01-FEB-02 lecturer             7893860298
       101 rama                 01-FEB-02 lecturer             7893860298

SQL> insert into instructor values(&a,&b,&c,&d,&e);
Enter value for a: 102
Enter value for b: 'tanvi'
Enter value for c: '12-dec-92'
Enter value for d: 'lecturer'
Enter value for e: 123456
old   1: insert into instructor values(&a,&b,&c,&d,&e)
new   1: insert into instructor values(102,'tanvi','12-dec-92','lecturer',123456)

1 row created.

SQL> select *from instructor;

   INST_ID NAME                 DOB       POST                       PHNO
---------- -------------------- --------- -------------------- ----------
       101 rama                 01-FEB-02 lecturer             7893860298
       101 rama                 01-FEB-02 lecturer             7893860298
       102 tanvi                12-DEC-92 lecturer                 123456

SQL> insert into instructor values(&a,&b,&c,&d,&e);
Enter value for a: 103
Enter value for b: 'lakshmi'
Enter value for c: '08-mar-95'
Enter value for d: 'lecturer'
Enter value for e: 34567
old   1: insert into instructor values(&a,&b,&c,&d,&e)
new   1: insert into instructor values(103,'lakshmi','08-mar-95','lecturer',34567)

1 row created.

SQL> /
Enter value for a: 104
Enter value for b: 'sita'
Enter value for c: '23-may-03'
Enter value for d: 'lecturer'
Enter value for e: 45678
old   1: insert into instructor values(&a,&b,&c,&d,&e)
new   1: insert into instructor values(104,'sita','23-may-03','lecturer',45678)

1 row created.

SQL> select *from instructor;

   INST_ID NAME                 DOB       POST                       PHNO
---------- -------------------- --------- -------------------- ----------
       101 rama                 01-FEB-02 lecturer             7893860298
       101 rama                 01-FEB-02 lecturer             7893860298
       102 tanvi                12-DEC-92 lecturer                 123456
       103 lakshmi              08-MAR-95 lecturer                  34567
       104 sita                 23-MAY-03 lecturer                  45678

SQL> insert into instructor values(&a,&b,&c,&d,&e);
Enter value for a: 105
Enter value for b: 'bharat'
Enter value for c: '12-dec-99'
Enter value for d: 'lecturer'
Enter value for e: 78945
old   1: insert into instructor values(&a,&b,&c,&d,&e)
new   1: insert into instructor values(105,'bharat','12-dec-99','lecturer',78945)

1 row created.

SQL> select *from instructor;

   INST_ID NAME                 DOB       POST                       PHNO
---------- -------------------- --------- -------------------- ----------
       101 rama                 01-FEB-02 lecturer             7893860298
       101 rama                 01-FEB-02 lecturer             7893860298
       102 tanvi                12-DEC-92 lecturer                 123456
       103 lakshmi              08-MAR-95 lecturer                  34567
       104 sita                 23-MAY-03 lecturer                  45678
       105 bharat               12-DEC-99 lecturer                  78945

6 rows selected.

SQL> update instructor set name='isha' where inst_id=105;

1 row updated.

SQL> select *from instructor;

   INST_ID NAME                 DOB       POST                       PHNO
---------- -------------------- --------- -------------------- ----------
       101 rama                 01-FEB-02 lecturer             7893860298
       101 rama                 01-FEB-02 lecturer             7893860298
       102 tanvi                12-DEC-92 lecturer                 123456
       103 lakshmi              08-MAR-95 lecturer                  34567
       104 sita                 23-MAY-03 lecturer                  45678
       105 isha                 12-DEC-99 lecturer                  78945

6 rows selected.

SQL> update instructor set dob='31-mar-2000' where inst_id=102;

1 row updated.

SQL> select *from instructor;

   INST_ID NAME                 DOB       POST                       PHNO
---------- -------------------- --------- -------------------- ----------
       101 rama                 01-FEB-02 lecturer             7893860298
       101 rama                 01-FEB-02 lecturer             7893860298
       102 tanvi                31-MAR-00 lecturer                 123456
       103 lakshmi              08-MAR-95 lecturer                  34567
       104 sita                 23-MAY-03 lecturer                  45678
       105 isha                 12-DEC-99 lecturer                  78945

6 rows selected.

SQL> select name,inst_id from instructor where phno=34567;

NAME                    INST_ID
-------------------- ----------
lakshmi                     103

SQL> select name,inst_id from instructor;

NAME                    INST_ID
-------------------- ----------
rama                        101
rama                        101
tanvi                       102
lakshmi                     103
sita                        104
isha                        105

6 rows selected.

SQL> delete from instructor where name='tanvi';

1 row deleted.

SQL> select *from instructor;

   INST_ID NAME                 DOB       POST                       PHNO
---------- -------------------- --------- -------------------- ----------
       101 rama                 01-FEB-02 lecturer             7893860298
       101 rama                 01-FEB-02 lecturer             7893860298
       103 lakshmi              08-MAR-95 lecturer                  34567
       104 sita                 23-MAY-03 lecturer                  45678
       105 isha                 12-DEC-99 lecturer                  78945

SQL> truncate table instructor;

Table truncated.

SQL> select *from instructor;

no rows selected

SQL> desc instructor;
 Name                                      Null?    Type
 ----------------------------------------- -------- ----------------------------
 INST_ID                                            NUMBER(4)
 NAME                                               VARCHAR2(20)
 DOB                                                DATE
 POST                                               VARCHAR2(20)
 PHNO                                               NUMBER(10)


SQL> alter table instructor
  2  drop column name;

Table altered.

SQL> desc instructor;
 Name                                      Null?    Type
 ----------------------------------------- -------- ----------------------------
 INST_ID                                            NUMBER(4)
 DOB                                                DATE
 POST                                               VARCHAR2(20)
 PHNO                                               NUMBER(10)

